{
    "component": "fpp-lof-audio-sync",
    "current": {
        "asset_count": 2,
        "generation": "20260923T020000Z-5e1f0a3c",
        "manifest_sha256": "903dea47dc8f5b9717c02177787bf49768b1a89b470d2d46e31c6b3bf4692e33",
        "profile_id": "lof-viewer-aac-lc-m4a-v1",
        "total_bytes": 45056
    },
    "generated_utc": "2026-09-23T02:00:07Z",
    "health_version": 1,
    "previous_generation": "20260922T020000Z-0b7d3e21",
    "role": "viewer-rendition",
    "state": "ok"
}
